<?xml version="1.0" encoding="UTF-8"?>
<unit_mutations xmlns:xsi="http://www.w3.org/2001/XMLSchema-instance"
	xsi:noNamespaceSchemaLocation="validation/punkapocalyptic-model-unit-mutation.xsd">
	<unit_mutation>
		<unit>mutard</unit>
		<max_mutations>3</max_mutations>
	</unit_mutation>
	<unit_mutation>
		<unit>pit_beast</unit>
		<max_mutations>1</max_mutations>
		<white_list>
			<mutation>acid_spit</mutation>
			<mutation>brutal_charge</mutation>
			<mutation>extra_limbs</mutation>
			<mutation>poisoned_claws</mutation>
			<mutation>sure_feet</mutation>
			<mutation>thorns</mutation>
		</white_list>
		<initial>
			<mutation>hunk</mutation>
			<mutation>resilient</mutation>
			<mutation>tough_skin_2</mutation>
		</initial>
	</unit_mutation>
</unit_mutations>